{
  "engine": "piper",
  "voice": "en_US-ljspeech-high",
  "license": "Piper MIT; voice en_US-ljspeech-high trained from scratch on the public-domain LJ Speech dataset",
  "commercialUse": true,
  "segments": [
    {
      "text": "This is MOONKATTY NEWS. Three world stories, each checked against at least two independent sources.",
      "file": "/workspace/news-launch/artifacts/test-episode/voiceover/scene-0.wav",
      "durationSec": 7.191837
    },
    {
      "text": "The Guardian reports: Alberta voters overwhelmingly reject plan to leave Canada in referendum. CBS News reports: Voters reject separation of Alberta from Canada in referendum.",
      "file": "/workspace/news-launch/artifacts/test-episode/voiceover/scene-1.wav",
      "durationSec": 12.822676
    },
    {
      "text": "NPR reports: Nigeria confirms an Ebola case in Abuja as a woman arriving from Uganda tests positive. ABC News reports: Nigeria confirms Ebola case in Abuja as woman who arrived from Uganda tests positive.",
      "file": "/workspace/news-launch/artifacts/test-episode/voiceover/scene-2.wav",
      "durationSec": 16.073469
    },
    {
      "text": "BBC News reports: UK to deploy jets to defend Saudi Arabia from Houthi attacks. The Guardian reports: UK to deploy fighter jets to protect Saudi Arabia from Houthi attacks.",
      "file": "/workspace/news-launch/artifacts/test-episode/voiceover/scene-3.wav",
      "durationSec": 13.670204
    },
    {
      "text": "These accounts come from the sources named in this edition. This edition is waiting for approval and has not been published.",
      "file": "/workspace/news-launch/artifacts/test-episode/voiceover/scene-4.wav",
      "durationSec": 6.680998
    }
  ]
}